{
  "$schema": "https://json-schema.org/draft/2020-12/schema",
  "$id": "https://raw.githubusercontent.com/guillaumevele/agent-proof-kit/v0.5.0/schemas/bytefence-intent-v0.1.schema.json",
  "title": "ByteFence exactReplace intent v0.1",
  "type": "object",
  "additionalProperties": false,
  "required": [
    "$schema",
    "operation",
    "targetPath",
    "encoding",
    "oldText",
    "newText",
    "expectedOccurrences"
  ],
  "properties": {
    "$schema": {
      "const": "https://raw.githubusercontent.com/guillaumevele/agent-proof-kit/v0.5.0/schemas/bytefence-intent-v0.1.schema.json"
    },
    "operation": {
      "const": "exactReplace"
    },
    "targetPath": {
      "type": "string",
      "minLength": 1,
      "maxLength": 4096
    },
    "encoding": {
      "const": "utf-8"
    },
    "oldText": {
      "type": "string",
      "minLength": 1
    },
    "newText": {
      "type": "string"
    },
    "expectedOccurrences": {
      "const": 1
    }
  }
}
