{
  "$schema": "https://raw.githubusercontent.com/guillaumevele/agent-proof-kit/v0.5.0/schemas/bytefence-intent-v0.1.schema.json",
  "operation": "exactReplace",
  "targetPath": "workspace/roles.conf",
  "encoding": "utf-8",
  "oldText": "role=reader",
  "newText": "role=writer",
  "expectedOccurrences": 1
}
