{
  "$schema": "https://raw.githubusercontent.com/guillaumevele/agent-proof-kit/v0.5.0/schemas/bytefence-intent-v0.1.schema.json",
  "operation": "exactReplace",
  "targetPath": "workspace/large-config.txt",
  "encoding": "utf-8",
  "oldText": "line-024: mode=before",
  "newText": "line-024: mode=after",
  "expectedOccurrences": 1
}
