{
  "$schema": "https://raw.githubusercontent.com/guillaumevele/agent-proof-kit/v0.5.0/schemas/bytefence-intent-v0.1.schema.json",
  "operation": "exactReplace",
  "targetPath": "workspace/mixed-eol.js",
  "encoding": "utf-8",
  "oldText": "target = \"before\"",
  "newText": "target = \"after\"",
  "expectedOccurrences": 1
}
