{
  "$schema": "https://raw.githubusercontent.com/guillaumevele/agent-proof-kit/v0.5.0/schemas/bytefence-intent-v0.1.schema.json",
  "operation": "exactReplace",
  "targetPath": "workspace/config.js",
  "encoding": "utf-8",
  "oldText": "mode = \"safe\"",
  "newText": "mode = \"strict\"",
  "expectedOccurrences": 1
}
